{
  "recordId": "gate2a-p-classification-authority-pending",
  "contractVersion": "0.13.0-draft",
  "recordKind": "classification-authority",
  "governedArtifactPath": "auditors/problem-evidence/gate2a-p/manifest.json",
  "governedArtifactDigest": "a4f754c6d3de82d1426cd2693cf11e3832d925235a54562fc6c7833a86fe313e",
  "digestAlgorithm": "json.dumps-sort-keys-compact-sha256",
  "authorityStatus": "not-approved",
  "approvedBy": null,
  "approvedTimestamp": null,
  "approvedForObligationPartIds": [],
  "scopeOfDecision": "Illustrative example of the external classification-authority record shape. No classification authority has been approved. Absent an approved record, OP-026-a's rule evaluates to indeterminate; the obligation remains source-derived.",
  "doesNotEstablish": [
    "Authenticated reviewer identity",
    "Tamper-proof detached authority",
    "That any classification is correct",
    "Operational comparator permission",
    "Runtime-enforcement permission",
    "Model compatibility approval",
    "Formal Phase 1 acceptance"
  ]
}
